{
  "version": 2,
  "updated_at": "2026-04-05",
  "title": "잠든 서고 개발 체크리스트",
  "intro": "이 문서는 지금 남아 있는 일만 빠르게 보기 위한 작업 목록이다.",
  "sections": [
    {
      "id": "priority_current",
      "title": "현재 우선순위",
      "source": {
        "type": "priority",
        "values": [
          "now"
        ]
      }
    },
    {
      "id": "checkpoint",
      "title": "중간 점검",
      "source": {
        "type": "spotlight",
        "value": "checkpoint"
      }
    },
    {
      "id": "loop_quality",
      "title": "루프 품질",
      "source": {
        "type": "area",
        "value": "loop_quality"
      }
    },
    {
      "id": "context_management",
      "title": "이전 내용 관리",
      "source": {
        "type": "area",
        "value": "context_management"
      }
    },
    {
      "id": "frontend_ux",
      "title": "프론트엔드 / UX",
      "source": {
        "type": "area",
        "value": "frontend_ux"
      }
    },
    {
      "id": "stability",
      "title": "안정화 / 유지보수",
      "source": {
        "type": "area",
        "value": "stability"
      }
    },
    {
      "id": "testing",
      "title": "테스트",
      "source": {
        "type": "area",
        "value": "testing"
      }
    },
    {
      "id": "worldbuilding",
      "title": "세계관 연출",
      "source": {
        "type": "area",
        "value": "worldbuilding"
      }
    },
    {
      "id": "later_backlog",
      "title": "지금은 미뤄도 되는 것",
      "source": {
        "type": "status",
        "value": "later"
      }
    }
  ],
  "active_items": [
    {
      "id": "prioritize-writing-support-over-flair",
      "title": "다음 단계부터는 연출 확장보다 `더 잘 쓰게 돕는 기능`을 우선한다.",
      "kind": "decision",
      "status": "todo",
      "priority": "next",
      "rank": 40,
      "updated_at": "2026-04-02",
      "spotlights": [
        "checkpoint"
      ],
      "tags": [
        "direction",
        "priority"
      ],
      "summary": "연출 확장 요청이 오더라도 루프 품질과 이어쓰기 지원 개선을 먼저 판단 기준에 둔다.",
      "acceptance": [
        "다음 체크리스트 변경 때 루프 품질, 문맥 관리, 재활용 연결 항목이 먼저 갱신된다.",
        "연출 항목은 핵심 작업을 막지 않는 범위에서만 추가한다."
      ]
    },
    {
      "id": "evaluate-next-step-by-loop-finish-and-session-carryover",
      "title": "다음 단계의 판단 기준은 `이번 루프를 더 잘 끝내게 돕는가`와 `다음 세션에서 더 쉽게 이어 쓰게 하는가` 두 가지로 둔다.",
      "kind": "decision",
      "status": "todo",
      "priority": "next",
      "rank": 50,
      "updated_at": "2026-04-02",
      "spotlights": [
        "checkpoint"
      ],
      "tags": [
        "direction",
        "evaluation"
      ],
      "summary": "새 기능을 넣을 때 즉시 효용과 세션 간 연결성을 함께 본다.",
      "acceptance": [
        "새 항목 설명에 현재 루프 효용 또는 다음 세션 연결 이유가 포함된다.",
        "우선순위 조정 시 두 기준 가운데 무엇을 강화하는지 기록한다."
      ]
    },
    {
      "id": "expose-loop-quality-records-clearly",
      "title": "루프별 품질 점수 기록을 더 명확히 노출",
      "kind": "task",
      "status": "todo",
      "priority": "now",
      "rank": 60,
      "updated_at": "2026-04-02",
      "areas": [
        "loop_quality"
      ],
      "tags": [
        "quality",
        "ui"
      ],
      "summary": "점수와 근거가 현재 카드와 상세에서 더 빨리 읽히도록 밀도를 조정한다.",
      "acceptance": [
        "카드에서 현재 품질 점수와 판단 상태를 바로 읽을 수 있다.",
        "상세 화면에서 점수 근거를 별도 탐색 없이 확인할 수 있다."
      ],
      "relates_to": [
        "surface-loop-quality-score-and-reason"
      ]
    },
    {
      "id": "compare-improvement-between-loops",
      "title": "이전 루프 대비 개선 여부 비교",
      "kind": "task",
      "status": "todo",
      "priority": "now",
      "rank": 70,
      "updated_at": "2026-04-02",
      "areas": [
        "loop_quality"
      ],
      "tags": [
        "quality",
        "comparison"
      ],
      "summary": "현재 루프가 직전 루프보다 좋아졌는지, 악화됐는지, 유지됐는지를 구조적으로 남긴다.",
      "acceptance": [
        "히스토리 상세에서 직전 루프 대비 개선 여부를 표시한다.",
        "비교 기준이 quality 데이터에 구조 필드로 저장된다."
      ],
      "relates_to": [
        "surface-loop-quality-score-and-reason"
      ]
    },
    {
      "id": "connect-repeated-feedback-to-prompt-adjustment",
      "title": "반복되는 지적을 프롬프트 보정에 연결",
      "kind": "task",
      "status": "todo",
      "priority": "now",
      "rank": 80,
      "updated_at": "2026-04-02",
      "areas": [
        "loop_quality"
      ],
      "tags": [
        "feedback",
        "prompts"
      ],
      "summary": "카논과 에코가 반복해서 남기는 약점을 다음 루프 프롬프트나 메모에 재주입한다.",
      "acceptance": [
        "반복 지적을 묶는 규칙이 정의된다.",
        "다음 루프 입력에 자동 보정된 메모가 포함된다."
      ],
      "relates_to": [
        "canon-feedback-structured",
        "echo-comment-structured-axes",
        "work-context-storage-structure"
      ]
    },
    {
      "id": "work-context-storage-structure",
      "title": "작품별 문맥 저장 구조",
      "kind": "task",
      "status": "todo",
      "priority": "now",
      "rank": 40,
      "updated_at": "2026-04-02",
      "areas": [
        "context_management"
      ],
      "tags": [
        "context",
        "works"
      ],
      "summary": "최근 원문, 요약, 고정 메모를 작품 기준으로 묶는 저장 구조를 만든다.",
      "acceptance": [
        "작품 id 기준으로 문맥 데이터를 불러오고 저장할 수 있다.",
        "루프 실행 시 선택한 작품 문맥이 payload에 포함된다."
      ]
    },
    {
      "id": "auto-summary-generation",
      "title": "자동 요약 생성",
      "kind": "task",
      "status": "todo",
      "priority": "now",
      "rank": 20,
      "updated_at": "2026-04-02",
      "areas": [
        "context_management"
      ],
      "tags": [
        "summary",
        "context"
      ],
      "summary": "긴 원문이나 누적 히스토리를 다음 세션에 이어쓰기 좋은 압축 요약으로 만든다.",
      "acceptance": [
        "요약 생성 결과를 작품 문맥에 저장할 수 있다.",
        "다음 루프 입력 시 자동 요약을 선택적으로 포함할 수 있다."
      ],
      "relates_to": [
        "work-context-storage-structure"
      ]
    },
    {
      "id": "recent-n-source-input-ux",
      "title": "최근 N개 원문 입력 UX 개선",
      "kind": "task",
      "status": "todo",
      "priority": "next",
      "rank": 10,
      "updated_at": "2026-04-02",
      "areas": [
        "context_management"
      ],
      "tags": [
        "input",
        "ux"
      ],
      "summary": "최근 입력 원문을 다시 불러오고 재사용하는 흐름을 덜 번거롭게 만든다.",
      "acceptance": [
        "최근 원문 목록을 빠르게 선택할 수 있다.",
        "선택한 원문이 현재 입력과 충돌 없이 병합된다."
      ]
    },
    {
      "id": "manual-summary-edit-and-pin",
      "title": "요약 수동 편집/고정",
      "kind": "task",
      "status": "todo",
      "priority": "next",
      "rank": 30,
      "updated_at": "2026-04-02",
      "areas": [
        "context_management"
      ],
      "tags": [
        "summary",
        "editing"
      ],
      "summary": "자동 요약을 사용자가 직접 다듬고 다음 세션 기준점으로 고정할 수 있게 한다.",
      "acceptance": [
        "자동 생성된 요약을 수동으로 수정해서 저장할 수 있다.",
        "고정된 요약은 새 자동 요약으로 덮어쓰지 않는다."
      ],
      "relates_to": [
        "auto-summary-generation",
        "work-context-storage-structure"
      ]
    },
    {
      "id": "work-fixed-notes-rules",
      "title": "작품별 고정 메모 / 금지 규칙 / 유지 규칙 저장",
      "kind": "task",
      "status": "todo",
      "priority": "next",
      "rank": 50,
      "updated_at": "2026-04-02",
      "areas": [
        "context_management"
      ],
      "tags": [
        "rules",
        "memory"
      ],
      "summary": "작품마다 반드시 유지할 설정과 피해야 할 규칙을 구조 데이터로 보존한다.",
      "acceptance": [
        "작품 기준으로 고정 메모와 규칙을 저장할 수 있다.",
        "루프 실행 시 해당 규칙이 프롬프트에 자동 반영된다."
      ],
      "relates_to": [
        "work-context-storage-structure"
      ]
    },
    {
      "id": "context-overflow-prevention-strategy",
      "title": "컨텍스트 초과 방지 전략",
      "kind": "task",
      "status": "todo",
      "priority": "next",
      "rank": 60,
      "updated_at": "2026-04-02",
      "areas": [
        "context_management"
      ],
      "tags": [
        "context",
        "limits"
      ],
      "summary": "문맥 누적이 길어져도 루프 입력이 무너지지 않도록 압축 규칙과 우선순위를 둔다.",
      "acceptance": [
        "포함 순서와 생략 순서가 정의된다.",
        "긴 문맥에서도 초과 없이 실행 가능한 fallback이 있다."
      ],
      "relates_to": [
        "auto-summary-generation",
        "work-context-storage-structure"
      ]
    },
    {
      "id": "loop-quality-trend-ui",
      "title": "루프 품질 점수/개선 추세를 한눈에 보는 UI",
      "kind": "task",
      "status": "todo",
      "priority": "next",
      "rank": 110,
      "updated_at": "2026-04-02",
      "areas": [
        "frontend_ux"
      ],
      "tags": [
        "quality",
        "ui"
      ],
      "summary": "점수 비교와 추세를 시각적으로 한 번에 읽을 수 있게 한다.",
      "acceptance": [
        "최근 루프의 점수 추세를 한 화면에서 볼 수 있다.",
        "개선 여부와 현재 상태가 색인 가능 구조로 함께 노출된다."
      ],
      "relates_to": [
        "compare-improvement-between-loops",
        "expose-loop-quality-records-clearly"
      ]
    },
    {
      "id": "work-context-selection-and-pinned-summary-ui",
      "title": "작품별 문맥 선택과 요약 고정 UI",
      "kind": "task",
      "status": "todo",
      "priority": "next",
      "rank": 120,
      "updated_at": "2026-04-02",
      "areas": [
        "frontend_ux"
      ],
      "tags": [
        "context",
        "summary",
        "ui"
      ],
      "summary": "작품 문맥과 고정 요약을 메인 흐름 안에서 쉽게 고를 수 있게 한다.",
      "acceptance": [
        "현재 작품 문맥을 UI에서 선택할 수 있다.",
        "고정된 요약이 어떤 상태인지 화면에서 바로 확인된다."
      ],
      "relates_to": [
        "work-context-storage-structure",
        "manual-summary-edit-and-pin"
      ]
    },
    {
      "id": "title-transition-sound-glitch-option",
      "title": "타이틀 전환 효과의 사운드/글리치 옵션",
      "kind": "task",
      "status": "todo",
      "priority": "next",
      "rank": 130,
      "updated_at": "2026-04-02",
      "areas": [
        "frontend_ux"
      ],
      "tags": [
        "title-screen",
        "effects"
      ],
      "summary": "타이틀 전환 연출을 설정 가능한 옵션으로 분리한다.",
      "acceptance": [
        "사운드와 글리치 효과를 켜고 끌 수 있다.",
        "기본값이 사용자에게 과하지 않게 유지된다."
      ],
      "relates_to": [
        "title-screen-and-presentation"
      ]
    },
    {
      "id": "scene-transition-by-run-result-status",
      "title": "완료 / 조기 종료 / 실패 상태별 장면 전환 연출",
      "kind": "task",
      "status": "todo",
      "priority": "next",
      "rank": 60,
      "updated_at": "2026-04-02",
      "areas": [
        "worldbuilding"
      ],